{
  "schemaVersion": "1.0.0",
  "id": "maps-degradation",
  "name": "Google Maps latency, quota, and rejection degradation",
  "seed": "scenario-maps-degradation-v1",
  "profileIds": ["*"],
  "duration": { "value": 30, "unit": "minute" },
  "phases": [
    { "id": "healthy", "duration": { "value": 5, "unit": "minute" }, "loadMultipliers": { "apiRate": 1 } },
    { "id": "degraded", "duration": { "value": 20, "unit": "minute" }, "loadMultipliers": { "apiRate": 2, "outboundFanout": 1 } },
    { "id": "recovery", "duration": { "value": 5, "unit": "minute" }, "loadMultipliers": { "apiRate": 1.5 } }
  ],
  "parameters": { "providerResponses": ["latency", "quota-exhausted", "retryable-rejection", "non-retryable-rejection"], "authoritativeState": "must-remain-usable" },
  "fixtures": {
    "actors": [
      { "key": "user", "kind": "user", "tenantOrdinal": 0, "entityOrdinal": 0 },
      { "key": "trip", "kind": "trip", "tenantOrdinal": 0, "entityOrdinal": 0 },
      { "key": "command", "kind": "command", "tenantOrdinal": 0, "entityOrdinal": 0 },
      { "key": "event", "kind": "event", "tenantOrdinal": 0, "entityOrdinal": 0 }
    ],
    "references": [
      { "from": "user", "to": "command", "tenantOrdinal": 0 },
      { "from": "command", "to": "trip", "tenantOrdinal": 0 },
      { "from": "event", "to": "command", "tenantOrdinal": 0 }
    ]
  },
  "externalServices": [{
    "name": "Google Maps",
    "mode": "simulated-degradation",
    "assumption": "No Google API call is made; response classes and latency are injected by a future runner.",
    "documented": true
  }]
}
