{
  "schemaVersion": "1.0.0",
  "id": "service-day-boundary",
  "name": "Multiple time zones, DST boundary, overnight runs, and close",
  "seed": "scenario-service-day-boundary-v1",
  "profileIds": ["*"],
  "duration": { "value": 4, "unit": "hour" },
  "phases": [
    { "id": "pre-boundary", "duration": { "value": 1, "unit": "hour" }, "loadMultipliers": { "trips": 0.25, "apiRate": 0.5 } },
    { "id": "dst-and-midnight", "duration": { "value": 2, "unit": "hour" }, "loadMultipliers": { "trips": 0.5, "apiRate": 1, "outboundFanout": 1 } },
    { "id": "service-close", "duration": { "value": 1, "unit": "hour" }, "loadMultipliers": { "apiRate": 1, "outboundFanout": 0.5 } }
  ],
  "parameters": { "timeZones": ["America/Los_Angeles", "America/Denver", "America/Chicago", "America/New_York"], "dstCases": ["spring-forward", "fall-back"], "overnightRuns": true },
  "fixtures": {
    "actors": [
      { "key": "user", "kind": "user", "tenantOrdinal": 0, "entityOrdinal": 0 },
      { "key": "trip", "kind": "trip", "tenantOrdinal": 0, "entityOrdinal": 0 },
      { "key": "command", "kind": "command", "tenantOrdinal": 0, "entityOrdinal": 0 },
      { "key": "event", "kind": "event", "tenantOrdinal": 0, "entityOrdinal": 0 }
    ],
    "references": [
      { "from": "user", "to": "trip", "tenantOrdinal": 0 },
      { "from": "command", "to": "trip", "tenantOrdinal": 0 },
      { "from": "event", "to": "command", "tenantOrdinal": 0 }
    ]
  },
  "externalServices": [{
    "name": "time-source",
    "mode": "deterministic-clock",
    "assumption": "A future runner must inject a fixed clock and IANA time-zone database version; no wall clock or provider is assumed.",
    "documented": true
  }]
}
