{
  "schemaVersion": "1.0.0",
  "id": "morning-surge",
  "name": "Morning import and dispatch surge",
  "seed": "scenario-morning-surge-v1",
  "profileIds": ["*"],
  "duration": { "value": 60, "unit": "minute" },
  "phases": [
    { "id": "warmup", "duration": { "value": 10, "unit": "minute" }, "loadMultipliers": { "importRows": 1, "apiRate": 1, "outboundFanout": 1 } },
    { "id": "ten-x-surge", "duration": { "value": 30, "unit": "minute" }, "loadMultipliers": { "importRows": 10, "apiRate": 10, "outboundFanout": 5, "realtimeConnections": 2 } },
    { "id": "recovery", "duration": { "value": 20, "unit": "minute" }, "loadMultipliers": { "importRows": 2, "apiRate": 2, "outboundFanout": 2 } }
  ],
  "parameters": { "routeDemandGeneration": "simulated", "importAcknowledgement": "asynchronous" },
  "fixtures": {
    "actors": [
      { "key": "tenant", "kind": "tenant", "tenantOrdinal": 0, "entityOrdinal": 0 },
      { "key": "user", "kind": "user", "tenantOrdinal": 0, "entityOrdinal": 0 },
      { "key": "trip", "kind": "trip", "tenantOrdinal": 0, "entityOrdinal": 0 },
      { "key": "command", "kind": "command", "tenantOrdinal": 0, "entityOrdinal": 0 },
      { "key": "event", "kind": "event", "tenantOrdinal": 0, "entityOrdinal": 0 }
    ],
    "references": [
      { "from": "user", "to": "trip", "tenantOrdinal": 0 },
      { "from": "command", "to": "trip", "tenantOrdinal": 0 },
      { "from": "event", "to": "command", "tenantOrdinal": 0 }
    ]
  },
  "externalServices": [{
    "name": "maps-and-import-providers",
    "mode": "simulated",
    "assumption": "Address, routing, and broker behavior is modeled without network or paid API calls.",
    "documented": true
  }]
}
